{
  "text": "Problem: Small SaaS teams waste 6+ hours/week manually reconciling invoices from multiple payment processors.\n\nSolution: A reconciliation dashboard that ingests Stripe, PayPal, and bank CSV exports and auto-matches transactions by amount, date window, and customer ID.\n\nTarget User: Two- to ten-person B2B SaaS companies without a dedicated finance hire, where a founder or ops lead does the monthly close across Stripe, PayPal, and a business bank account.",
  "problem": "Small SaaS teams waste 6+ hours/week manually reconciling invoices from multiple payment processors.",
  "solution": "A reconciliation dashboard that ingests Stripe, PayPal, and bank CSV exports and auto-matches transactions.",
  "target_user": "Two- to ten-person B2B SaaS companies without a dedicated finance hire, where a founder or ops lead does the monthly close across Stripe, PayPal, and a business bank account."
}
